label_bullying,text_message
0,I remember trying one of those when my teen was a little one.  Those damn tents make u wanna commit murder!
0,i was up till 2 am messin wit toys and batteries.  now i got a lil t-rex making noise in my house.  Damn noisy toys.
0,stay warm  Kyle. that sucks. we were lucky to get ours back today.
0,Hahaha... I guess I m loser now. I dont go out much! When I get my new job  maybe I will visit Longhis :)
0,Thanks... you are the sweetest! :) Are they fat free?
0,myspace does not hate you.
0,that sucks I hope u can get out of it...where did u apply to?
0,"Often I feel like the only Jew who does not equate ""political criticism of Israel's actions"" and ""hate for all Jews""."
0,Vote or die  bitch!
0,oh wow dude thst one hell of a kick ass mission!
0,I hate to hear about all the accidents. People need to slow down and be more careful and even more so during the holiday season.
0,dead ass lol
0,ooooh! Don't make me come out there now! Whatchoo know about silk's freak me? Nah wait...you need to lose control first
0,I have you beat - amazon and a bunch of poser stores email me too haha
0,I hate to tell you this; your good name is being used for phishing! You should change your password. http://status.twitter.com/
0,Damn. That is tired.
0,btw i saw your gift last night. You are going to freak out.
0,Well then get some damn sleep ya dumbass! Lol
0,OMG! To damn funny. U need 2 video that shit. Lol
0,I hate you.
0,damn twitter.  Sheez...
0,Its freaking me out. 1999 wasn't long ago. But 10 years. FUCK.
0,i hate blackbird cause it's never enough food
0,after that aired on cnn  my mom wrote me an email asking i knew about emo and if i was ok...WAT
0,those damn kids ruin it for all of us!
0,YEP! HATE LIFE right now. HE is a computer hacker geek stay@home dad whom THEY HAD to move out of STATE!(she's a DR.) long story~
0,cont. I would get embarraced  I didnt do drugs but was like a HUGE man with what I could handle?sucks I guess if I wanted to ; )
0,wow... I feel like a real loser now! ; ) haha  better get my but in gear!
0,Thank You  Thank You.  I would hate to get banned from either  but. Phew! My bad...
0,Hate to say it to you or hurt your feelings  Justine  but your Steelers are going DOWN next weekend!
0,Damn.  Next thing you'll be telling me  Rumple of the Bailey isn't a documentary.
0,way to hate on me before 7 am!! Yes  and to ALL you tweets...I made the Lightening McQueen cake.
0,y do u post pictures of fat girls all the time.  Does it make u feel better?
0,lol fuck it &#58126;
0,what up freak nasty.
0,damn! good job.
0,"""fuck the recession"""
0,hate you...it's freezing here...my nipples will freeze off before I get home
0,slut...just pelvic thrust anyone
0,god that show sucks...
0,will do :) ha I don't mean to sound gay but I have no layers in my hair after tour so well see how it goes ha
0,she ain't a bitch I'm just pretty awesome
0,nah  i just think i deserve it. sometimes  you have to reward yours. its been 3 years since my fat boy days
0,OMG. I kist realized ... I hope work doesn't think I'm calling in gay.
0,cunt!!!! i love you!!!!
0,i'm so fucking sick of being easily disposed of.  what's wrong with me kitty kat?
0,Thanks Kitty....... and hey  i'm thinking of calling in gay tomorrow too!
0,but u have to process the milk in some fashion to cut the fat content in half
0,Wait  you hate hfcs but you drink diet coke?  Head asplode.
0,Like fuck I am.
0,I'm your fucking Da and I'm not gonna come in tomorrow :)
0,NINJAS kick ass they dont rape ass unlike pirates
0,why the fuck wouldn't you?
0,As a former newspaper man I have to tell you that I see no reason for a bailout. Then again I hate bailouts in general.
0,that PC thing is fucking awesome
0,Make sure it matches. I hate furnaces that clash with the house. sainless steal or gold go with anything.
0,That sucks man! Hope you start feeling better. I hope you and your family have a very Merry Christmas!
0,But i agree that Walmart sucks :)
0,I'm doing both. And it sucks. But I've got a lot done (work-wise) & then will spend the day finishing some Christmas stuff
0,and let the merciless fun-making of the latin nerd commence....now.
0,The winner eats the blintz  and the loser(s) watch the winner eat the blintz. Marquess of Queensbury rules apply. En garde!
0, yah  but YOU get to tweet from your couch or bed or whatever.  I gotta sit on this hard chair on my computer I hate.
0,I hate to hear that... Please let me know if you have any issues with the return and I'll remedy... because I can :)
0,I relate to that kind of thinking. I hate eating salads (but I eat them anyway) and I feel I'm justified to reward myself!
0,If the damn Vikings  would have won yesterday like the should have  this game wouldn't matter.
0,The libertarian case for gay marriage.  http://tinyurl.com/2f6xbm
0,that sucks.  gg was fantastic this week 
0,had to document it just incase i was going mad myself. and i don't even like cock. what are they trying to suggest?
0,fag face
0,I'll have to work on that one.  Ass clown is a solid contender.
0,damn I want some Frenchys... A 3 piece white with fries and cornbread.
0," Instead of letting a couple of million people live for 60 years as ""prisoners"" and thereby indirectly nurturing the hate."
0,Scary? Yes. It's also really fucking cool. It reads like science fiction.
0,I also just got Emma as well. I've been a lit nerd too long not to have read Austen. I have shame regarding this.
0,here's some cock for u http://twitpic.com/rrvm
0,Actaully  after you sent that I had to sit down for dinner.  Hate to break it to you  but grandma said you had to leave.
0,They'd have had flying cars by 2015  too. I want my damn flying car  dammit.
0,It's pretty damn similar  that (bass?) guitar part  at least. I owe you something nice for this  btw.
0,Mosey is a whore for attention.
0,What's happening brotha? I'm good. Been a busy day getting ready for my big fat free bootcamp manana! How about you?
0,lol so much for one huge ass exp. btw did you publish anything official yet?
0,fat browser? tell me more! like gOS/CloudOS?
0,It is less that 2 feet from the front to back. 3.5 wide from left to right. SMALL ASS DESK
0, i'm actually refreshing wil wheaton's blog right now to find out about his incredible announcement. i just can't help my inner nerd.
0,thanks  nerd.
0,damn  you beat me to that example. :) #journchat
0,Fuck that  this hot winter is awesome.
0,Yep  I hate paying taxes too and the more I make the more I pay  but it's part of life and not a waste of money.
0,"... that is funny... not two seconds ago  somebody walked by office and said ""I hate winter!""  LOL"
0,Just another day  money to be made  got my hater blockers on for those haters who goin hate... Thats how im feeling today.
0,I just use the standard twitter site and it's tough.  :P  WOuld hate to find another addiction to go along with this one.
0,that's why hatemail is so hilarious!  i love hate mail!
0,people that want to make sure that you know that they HATE HATE HATE lolis
0,i love how every forum has someone fall over themself to make sure that everyone knows they hate lolis/moe/fansubs/mecha/yaoi
0,damn ... that sounds real appealing now. Maybe geothermal coupled with wind and solar ... tho maybe heat coils take too much power
0,@TheMadMat damn ... well then it was definitely worth a second mention. Sure looks good!
0,Did you see the Dick/Rich video yet?  http://tinyurl.com/697e3g
0,I wish I had a Christmas vacation.  Damn Facbook and its holiday perks!
0,I hate that I couldn't guess MJ  that songs an obvious classic. Guess I need to take some time and listen to the 70s groove.
0,I think they'd say fuck you right back lol.
0,I hate when you get stuck out in the cold wearing cons.
0,this should have ended months ago  sucks.
0,he said don't hate....
0,yeah. It's ugly! And their rebounding sucks!
0,i always fall on ice! It's my third time this winter! Ugh i hate snow sometimes.
0,GO pkzwrt's hommy Barry's ex-scharrel de lijst regelaares! (damn!)
0,Sonic CD and the Lunar games... might also try to go for Third World War and Popful Mail if I absolutely lose my fucking mind.
0,hey praying for u man. I hate strep
0,"I didn't think about drinking every time she said ""maverick."" Damn. Could have done it every time she talked about energy  too."
0,Cool. I live in Seattle where the wind pretty much sucks (it's like San Diego  but Northier). So  I usually go to Hawaii 4 my fix
0,i heard traffic going to fart chips land!!! some crazy ass accident
0,stop being a pussy. you look hot.
0,"Uh  I don't really have a people preference. LA comes in last (hate the sprawl  lack of transportation  etc  it's not a ""city"")."
0,yup  those are kick ass.  great job.
0,That sucks beans. What will give it the zest of life? The bite of beautiful fruit? Even the audacious appeal of deliciousness?
0,we lose perspective living around so many fit austinites. I freak every time im in htown b/c of all the public smokers.
0,damn... i was just thinking of a cablazo this morning.
0,Fight the good fight. I sympathize. I hate to update! And W P is goshzillions better than what I had!
0,hey umm.. talisa  even tho I don't give a rats ass bout this shit   | talisa  the damn monkey mail doesn't come on monday lol
0,imma be as nice as possible alrite. talisa how the fuck do I kno? do I watch da disney channel' ? uhh. . noo nigga lol
0,thats not cold. its 4 fucking degrees here with a wind chill of -5! thats damn cold!
0,damn  you twitter like crazy!
0,oh ok..so technically u dont need that specific class...ok cuz i was about to say 2010  wtf? not for some dick lmao
0,"I hate the iPhone censorship  as I use the words that are auto-corrected to ""shot"" and ""duck"" quite frequently."
0,That is a massive FAIL. (I am being facetious  here.) I hate low-calorie anything  & it shows. LOL
0,already looking at 5 shows so damn excited hope to do SPAC
0,Cool - I've arrived. It's about damn time too....Merry Christmas Doll!
0,saw that cunt thrown in
0,@jackienopants I an wistfull that it will happen soon..damn sick of being on my own...one more week an counting
0,Meant 60s vaguely-lived in one 1980-91  still connected somewhat. Would you live that way again? I hate too many mtgs!
0,It's 53 here and supposed to be 25 by noon. Talk about a drop in tempature. The wind was howling all night. I hate winter!
0,Did you just call your mum a cunt? :O
0,mega pig out foodie session for you today!
0,You mean GMail Contacts doesn't hate me personally? I'm relieved! (Though I don't get a Forbidden  it just keeps loading forever)
0,BALLIN! on another note i hate nursing school why do i have to sit here and learn about the latest forms of birthcontrol wth!
0,Oh  I hate those things! Can you imagine if you were color blind  or dislexic (sp?).
0,Don't you hate that! BL is always on when I'm eating dinner and having my relax drink. Ugh!
0,U gave me ur insomnia Im drinkin mountain dew and blastin 50cent  I've lost my damn mind.
0,sadly i did have ideas stolen  more than once so now i'm a paranoid freak about it ... but I trust you  you like legos.
0,that gem fucking with santogold and kanye west is fucking sick! love it.
0,the man has talent and makes some damn good music. But he overrates himself sometimes.
0,dammit miller  that was from jes again...justin likes to auto log in on this damn crack site and i forget. doh!
0,...eatin' brownies like a retard! meah!
0,New Hampshire. They have receieved a reported 'metric ass ton' of snow. How's Detroit hanging in there?
0,That Cole lyric made me think of: I'm a kreep  I'm a loser You're so very special  I wish I was special. http://zi.ma/373a67
0,Well  it's @ElysiumGWJ 's turn. Noone takes @Certis seriously  and @Demiurge and @GWJRabbit get the hate mail all the time.
0,I hate milk! Egg nog sounds gross may b I'll try it this yr. U can mix it with Amaretto...that I may do.
0,& @VIChick: I feel as tho I spend every weekday waiting 4 the weekend. Then I spend the weekend dreading the damn work week.
0,Um...sorry  Yatty. HATE shopping this time of year. Do everything online. Good luck  though!
0,That would freak me out if all my cards suddenly stopped.
0,I hate it when they do that :3
0,ya. Luckly that hasn't happened in years. Sucks backing a semi just over half a mile.
0,CALIFORNICATION is about fucking  and how awesome it is to be David Duchovny and fuck hot young girls. Which is probably true.
0,broke freezing my ass off with -1 temps & ice lol.  Ross
0,Putting pants on sucks lol. Ross
0,Not 2 fuck up my life. Ross
0,I hope u had a kick ass day.  Ross
0,"The ""need work may have a piss test"" curse"
0,man Im coming to Santos tonight  ya'll sound like having a funky good time on a snowy ass day let alone a good day Im there
0,http://twitpic.com/xn5j - I want to suck your hard cock ....untie you and cum all I over my  face over lord Saltan.
0,i'm just getting over my sickness. It sucks. Feel better.
0,I know...it sucks. Tomorrow night!
0,I know! To be fair he's been working on law school apps all day. I already hate law school and he hasn't even started yet! :)
0,i kno u hate me but r u ok? Im always here for u if u need me.
0,during the week I'm more blk polo/cargo pants/white runners kinda guy. I pull out the nerd stuff for those who appreciate it.
0,tired as fuck and wish I was with you right now!
0,im jealous lol.  u better protect the penis at all times i dont care how cute YOU thought she was lol Hate hate hate
0,It's dry with fruit tones. Used to HATE anything but Clicquot before I tried Korbel Natural...
0,It is? I have been cybershopping for everything this year. I hate going into the store. Amazon.com is my retailer of choice. ;-)
0,I mix the low fat vanilla w/ the toffee to save some calories.
0,When we played the Star Wars drinking game  Pat chose to drink whenever the robots acted gay. He was trashed 10 minutes in.
0,Dude  the Melodramatist would be a good stage name for an emo musician. Or a magician. I think you could do either! :-)
0,yep. have some kind of infection in my foot. might be gout. sounds gross! hurts tho & i hate meds. make me sleepy! how you?
0,I hate moping. It's horrible. Mum makes me mop the kitchen floor sometimes and I always want to dieeeeeeeee.
0,yeah. the name didnt mean anything to them lol. i dun got death threats  hate mail. been blocked by people i dont even know lmao.
0,- There there *hugs* Nobody sucks in relationship. Maybe it's about timing and the people :) It's OK.
0,- Uh... Fail Whale? What Fail Whale? *whistling non-chalantly*
0,lmao  yea i know i hate it D:
0,figures...i hate when channels advertise for other channels...
0,gah. Hard to know which team to hate more. Usually the Bears  but maybe not this year.
0,well  damn  I thought we'd come to Florida. (Dream on  Karen.)
0,I gave up on lighting hell this year. Got a 9 ft. pre-lit fake.  Love the smell of real but hate creating demand for tree killin'
0,o Zacky i'm sorry that sucks!
0,  oi vey...sorry about the plumbing-i was standing in 2inches of water in my basement last night.  merry fucking holidays :-)
0,That's one thing I noticed when I first installed it too. Damn thing took over my preferences.
0,Lucky me  no snow in Hazel Park at least not yet. 2 inches expected . Daily fat burning walk to the end of my driveway  again.
0,Ooh  that sucks! Maybe it'll still turn up though. I've had pkgs get lost only to be found 3 wks later.
0,That sucks. My flight was delayed an hour. What terminal are you at?
0,damn why doesn't thwirl have spell checker?? But actually the ones the girls decorated are a bit on the mean side  hard to ice smiles
0,(avec un retard de 5 heures) Bonjour Semio!
0,omfggg facebook's being such a cock tonight.
0,I'm gonna use meebo and use it for my AIM account. I need to update too. I'm being such a lazy-ass XD
0,Thanks!  I hate not being able to do what I know is simple.  I'll DM her and deal with this tomorrow.
0,ur not emo becka
0, fuck em.... youre a nice guy.
0,i'm going to read so that i hate myself a little less.
0,I'm sure!! I despise cleaning  although I'm an organization freak!
0,That's what sucks: I don't actually get to do it. I just had to prove I could plan it out. -KayCee
0,a day like that'll make anyone a bitch  though. -KayCee
0,you need to eat more beets and freak them out next time.
0,I've been using thunderbird but am damn near ready to chuck it. too many smtp problems. three different servers points to client.
0, @steph125 says fag... no one likes jacob...  and im starting to  question ur 2nd to last twitter...
0, it contains 610 calories  330 from fat...
0,#NAME?
0,#NAME?
0,For the record  it's fucking freezing...
0,During hurricane Ike our power was out for 5 days  others for 2 weeks or more.  It really sucks after day 2.  Uggg  be well.
0,Call Guiness...the book not the beer.  You may be the 2008 iPhone App King-O-Rama gold medal winner. How many do you hate all in?
0,Downey is a freak of actor nature - he makes every character magnetic.  It was a winner.
0,They are hungry for democracy - most Westerners are fat  happy  complacent.  Brave New World v. 1984. Pleasure beats pain.
0,thank u! And damn that's a super long list.
0,it is one of my lesser performances. Iz kinda like fat elvis vs. young elvis.
0,why do i look so fat?
0,the snow storm you're having could possibly be the same one we had Friday it was horrible like 20-30cm of snow. I hate metrics
0,Damn that sounds so good I got fat just reading it  haha.
0,Yes  one of my fave movies... of... alll.... fucking time!
0,Damn.  That is a beautiful car.
0,yup!  Fat Albert is next
0,thanks  I'll give it a try... Just took a sudafed even tho I hate taking meds while preggers....see if that helps
0,Man up pussy. NO SMOKES FOR U!!
0,you hate is soooo cute though. &#9786;
0,oooh I had the sneezes for three days.  Dr. said it was going around but I had no other symptoms.  I hate to sneeze1 Fine now.
0,You went to the Fisher house? That is so cool! We finally made it to LA! 9 hours in the car sucks.
0,Just got it in !! quick little 15 min with a run up 6 flights !!! damn that cold air almost couldnt breathe !!
0,@homebasenyc Alice don't believe anything this kid says !!! I hate him  but only cause I love him so much..*sigh*
0,I know! Will it ever end? I hate these weekend renovators  it goes on for years!
0,being a control freak... it's like mental therapy to do stuff like Ann's.
0,I hate doing laundry PERIOD
0,hate MobileMe...but I host my website on there...
0,I hate the nod drivin. I got it about -10 in here & tryin 2 stay btwn the lines. Jesus help me!
0,Yeah  send me ur Wii number and Kart number. Ill send you mine. I will be happy to hand u ur ass in some Kart soon.
0,Unfortunately it's just beginning.  I hate winter too.
0,I HATE my white trash christmas outfit its terrible i look terrible and fat in it.  I dont know if i can do it.
0,are we going to see u in 2 wks?  Sorry life sucks (move to Fla! you know it would be fun)
0,finally someone reviews Death Proof and understands the film and why it's fucking awesome.
0,You have to work tomorrow... sucks. balls. are you working today?
0,damn how much did we end up with on the ground?
0,Are you saying it's a gift for people you feel little emotion for cuz I gave some to @ggilmore and he's my private dick... detective!
0,damn....I'm totally food aroused right now. HOT!
0,headed back to NC Thursday. Today DC American History Museum. I'll be the extra fat one in too small jeans. ah holidays...
0,I will vent/blog/whine about my poor character judgment skills  and ponder all the jollities a divorce has to offer. And be emo.
0,Like Dick Cheney has an issue maybe?
0,I haven't seen the movie but I read the book and sobbed. But I already know I'm a nerd.
0,You're content coz you have The Kooks!!! They're so damn feel good!
0,Weird. I read online that they helped. It could be this kind of apple too  they are pretty sweet. DAMN!
0,thanks! Sucks.. Its hard for me to let go of players that have been on the team since i started watching lol
0,no prob.. that's a good point! =( man this sucks...
0,you're so lucky! Then again its understandable with the weather over there. Still lucky. I hate school =(
0,I'm finally beginning to think that maybe I'm not so alone out here in nerd-land =)
0,Oh lots of them.  I mostly want the snow to look at and play in here.  Not big into skiing or boarding :P I'm a total loser!
0,damn!! man tell me her name :D
0,because someone that im not friends with anymore bought the shoes that i want just to piss me off. but im better now.
0,that sucks just saying ~*Krystle*~
0,Well I'm sure you'll feel better w a little Jizz in your pants over Heath. BTW  Jizz was so NOT this year's Dick in a Box!
0,will have 0the radio on Monday 4 all ur favorite Xmas tunes! paybks r a bitch and so am i. *Kate Souter*
0,fucking beautiful shoes.
0,i'm giving you a heart cuz i'm assuming this is me and byron  if not i hate u but here &lt;3
0,Cool buddy!  @tomvenuto 's new book The Body Fat Solution gets released on Thursday if you can help let me know
0,Yo Scott  @tomvenuto is launching Body Fat Solution book on Friday...  Any chance you can mail that day my friend?
0,and people are always telling me they hate research ha ;)
0,sucks your sick on X-mas.  Hope you're feeling better.  Drink lots of egg nog...  w/ RUM!
0,#NAME?
0,Pause and type quick notes  then edit at the end. I'd use a recorder but I hate transcribing. It's really helped my typing speed.
0,it's colder here. I hate snow.
0,sucks that the Source link is wrong
0,#NAME?
0,finally it took too damn long
0,I love fat albert!
0,but is it colder than penguin pussy?
0,At least I didn't get the candles that I stole...stolen.  I lucked out. The case of Fat Boys was also popular this year.
0,marerockcity fuck yes!  That's great have a safe drive
0,I'm so dropping the ball today homie. I'm like damn near dead  I'm so tired. Reschedule??? Sowwwyyyy
0,i know you hate cold weather  but if you get to see snow in indy  i will be jealous! i haven't seen snow in foreverrr.
0,safe travel tomorrow..back to reality--it sucks  I know..
0,damn..impressive
0,good morning Alexa!  Go kick some ass!!
0,I could NEVER hate YOU!  :-)
0,yeah. time zones are a bitch.
0,whoa you said cunt.. that kinda turned me on ;)
0,awwww im sorry to hear i know you and steph were so excited to move too :( i hate your neighbors sooo much!!!
0,don't hate!
0,Believe me most domainers HATE parking their domains. What evidence do you have supporting your allegations?
0,a friend of mine in history class. He's the best friend of the (closet) gay guy that wants to go out with me.
0,we say the same things cause we're fucking cool. You know how we roll. Love you like a fat kid loves cake.
0,Michelle is laughing her ass off as I am currently telling her the stories of last night.
0,thanks! this is the only thing that sucks about tourns.. playing 3 long grinding session for nothing.
0,yo yo. so  i emaled you about the 30th you study nerd.  :-)  let me know if that works!  xoxo
0,fuck yes.
0,GOOD. YOU'RE FLOODING MY INBOX LIKE THE CEDAR RIVER IN JUNE. BITCH I DON'T KNOW YOUR LIFE.
0,omg omg omg I am SO happy to see you on here! We're gonna have some fucking kickass fun. Fasten your seatbelt pussycat.
0,I personally hate all of Narrow Stairs. However  the Hold Steady is great  you're right.
0,The commercials are just so damn cute! Haha.
0,i have a headache too... hate having head aches...
0,What kind of math are you studying?  Just curious.  (I'm a nerd I guess...)
0,ha! not the stomach ache part the big and fat part
0,Haha  fat chance! Night! LoveLoveLove!
0,damn right I'm interested. I run beastsoftheeast.com
0,damn! I guess... Well... Cough cough... I... *smiling*
0,Fucking brilliant mate! Well done.
0,I can't believe you're still having Internet issues.  Pain in the ass!
0,Damn that sounds good.  I love hush puppies!
0,why you being so emo?!
0,congratu-fucking-lations  miss jenna!
0,Dick Rydeeeerrrrssss
0,Episode 4 fuck boy
0,i wish i didn't own it  it just takes up space here...i haven't even ever unboxed it  i hate games :P (jk  jk)
0,Don't hate me. I bought the Coldplay EP.
0,i hate planes...just try to sleep. Have a safe trip!
0,ouch that sucks.. Sorry I wouldn't even know of one in Cleveland.  I will stick with guitars.
0,i agree  tooooo damn cold!
0,so u hate christmas 2?
0,Damn - I'm really in trouble now. But I always like to take risks and clearly this is going to be one for me...Thx for checkin!
0,Yes... think about how many 32 oz cups of poison were sold this morning  2go with hearty breakfasts of fat & carbs.
0,sounds great  what time should I be there? Oh  I hate garlic  can u leave it off my broccoli? Kthxbai &#58389;
0,Hey Mr.B!  I'm having a nerd fest at the moment playing w/ my new Google Chrome.  How's life with you?
0,There are a few good knitting videos on Youtube. A combo of those  Stitch n Bitch  and nice neightbor ladies taught me :)
0,Jealous. Want. (But getting to places sucks so bad right now.)
0,don't hate!
0,haha  i only buy candles that smell like cupcakes... or cookies... i'm so fat.
0,ha ha ha ha damn good :D
0,I was *sure* I told you both at the wedding...Damn that open bar!
0,its fucking terrible my friend and I left
0,Nope. I fell on my ass on the way home.
0,it is our wedding anniversary today.  He got me NOTHING. Not even a damn card. So he should go and get me donuts!  LOL
0,oh man. You would love(or hate) my bacon chocolate.
0,"re:magpie  yeah  like I want to piss off everyone following me on Twitter for whatever they decide to send me ""up to...."""
