label_bullying,text_message
1,if you claim you do not have the power to forgive but only allah why then do you arrogate yourself the power to avenge are you not double speaking why not leave both powers to the owner allah and allow him to fight for himself or is he not capable we are not afraid of you we are not afraid of death everyone will eventually die both the killer and the killed our lord jesus long time ago warned us about sects like yours and encouraged us not to be afraid for you can only kill the body but can do no further harm after that you cannot kill our souls which ultimately goes back to our god so kill all you can jesus will forever remain lord
1,i told you before you poor excuse for a human being not to respond to my post but you do not listen you are ignorant you pathetic piece of feces i hope you get what you deserve in a fatal accident soon
1,apparently bad officiating never gets old to you morons
1,thanks for confirming that conservative men only see their women as a pair of tits and an azz
1,what is your deal bro you are not concerned and you damn sure are not a liberal why do not you just be yourself instead of coming on posing as a screwed up exaggeration of people you do not like or understand did your mommy not love you enough or something
1,klein you are a coward did you really interview these guys just to mock them best part is that you stop short of belittling scheartz even you know that would probably be the last straw in your downward career
1,oh all of a sudden u changed ur picture to a white guy with penny loafers mufucker u lame
1,you are naive and do not have a basic grasp on biology
1,nobody gives a shit what you say
1,bitch please you are the biggest troll p
1,you do not exist as a human being please go back into your hole you rotten scumbag
1,the article was about bush you asshole
1,yo disqus you must be too dumb to know what grand jury means plus who is going to testify against him the dead mexican go shove your idiotic comments up your you know what
1,hush little negro do not say a word mama gonna buy yawz some thunderbird
1,no you are a corny dumb ass
1,so you call her a w h o r e making you what pure you are a fool and an idiot
1,the same with write people every one do some drug in there life ok not all black people is drug addict so i would like you to stop hating on blacks ok you prick have some respect for him god know y he do what he did ok have a bless night u prick
1,when you say bama you are referring to the school like in your posts below stop being an idiot
1,no actually you have shown me no source all recent data has been shipments idiot your other comments would hurt if you were actually relevant moron of the year explain how that is still not dominant kid
1,stop acting like a bitch he was a kid for goodness sake
1,well we know you are to dumb you only chose that screen name to satisfy your overgrown ego
1,got a reference for that idiotic comment
1,to the idiots posting on here who think racism is alright well it is nor and if you were a victim of racism then you would know i feel like balli too and i would kick off as well even if meant i got arrested did you seem them dumb fkin poles and ukranians racist bigots racists have a place sure they do in the fkin gutter and you know what would stop racism immediately or bring it to the forefront if the racists were to throw swastikas at all the jewish players i bet the football bodies would take note immediately
1,oh you sit down and shut the fucck uup you mental retard what the fuck do you know retard i hate people like you why dont you go get violently killed in a car accident you fucking retarded dick headed bitch mother fuckin ass hole
1,evel dick gets my vote james r is a very creepy looking man mr rogers look alike plus he whined like a little bitch when janelle destroyed him in the otev pov comp
1,go ahead and try dude go fucking ahead
1,rob you have proven your point already we understood you are an antisemit you can relax now
1,it is a great honor to be a zionist you are garbage a retarded idiot
1,sgboy get back to your cot i hear your parents calling for you
1,you are a pig
1,fly away gay pussy fly away
1,we are not the losers but you and this country are
1,commenter your very childish grow up and be a man stupid remarks like yours just proves that you are a little boy and have yet to understand what it means to be an adult
1,provide proof faggot
1,your mother is the clubhouse whore
1,take your testament and shove it
1,suck ya dads dick ya stupid slut he is waiting u u probably ugly as fuck damn i know it sucks to be you trollin on a joke i made fall back b ihurt yo feelins ho
1,seems like you are on tik you moron are all people of your colour rapists of mothers and children i do not think so stop making idiot comments
1,you certainly come off as an arrogant s o b your right ends when the safety of others begins i do not give a rat s arse that you hunt but keep your bullets along with your second hand smoke away from me sheffield village is a sprawling area and you are living in the past you sir may have to find a new piece of hunting paradise to fulfill your desires as far as history goes tyhe indians hunted all over places change get with it or get out
1,whatisbannedisneversuppressed you re just a sorry ass commie are not you too lazy to get out of bed to better yourself much easier to sit back and let others do the hard graft and hand over money to you to live your commie dream never mind thinking big try working big that is what benefits all your type make me sick to my core
1,how stupid are you do you realize that many women take birth control pills for many reasons besides preventing pregnancy educate yourself fool
1,fucking idiots
1,you are a fighter not a lover and your family needs to die too
1,ok you are a complete retard re read what you just said about a bullpen you know nothing about baseball
1,stfu u dirty ugly wet musty hair havin rican dirty ass wetback i swear i cant stand u dirty ugly pale face wannabe white spics postin racist bs on wshh when u the least disliked group of ppl in america ima spit in the next lil wetback kids face when i see em because of u
1,that is a moronic response they should not repeat the crimes they commited please don t post your trash here
1,by your kind i mean angry little yankee know it alls who are complete white trash in the states they came from and move here and think they know everything because southerners are slow and backwards you were trash up there and you are trash down here go home and take all of your friends with you you are ruining our culture and quality of life although you sir would not understand anything about quality of life you are a pathetic internet troll who is entire life is sadly based around your pathetic rants on message boards go home dude
1,now you went and fucked up this whole page
1,you know it is so easy to talk shit about this you know nothing about what he was going thorough in his life so fuck off
1,you look like brian scalabrine s brother thoughts
1,and you need to know classified information because when it passes into history there is little anyone can do about it and in the meantime you really do not need that information i am guessing you just want to feel smug about getting it
1,you are an idiot why do you even bother wasted words
1,lol do you even realize you are making a fool of yourself i bet next you will post something like i forwarded your post to the fbi or maybe i told my mommy speaking of growing up get busy
1,you stupid f uu c k i hope you die the same way she did
1,but you could not show any proof of that even if it was true go away you are an embarassment to your klan brothers your family your neighbors your teachers and america as a whole find something to say that is not directly quoting nazi or stalinist propaganda the most pathetic poster on the web you are below oberbite a soros trool or the ignorant little heap that wwrote waiting to exhale
1,all these news are planted and for getting some extra media attention that is all bloody fucker ranbir fucker kapoor
1,are you fucking dumb making it clear that the group was delaying their comeback due to album production and not to avoid competition with other groups you should be thankful that ne did not cameback this june if ne did those awards will be owned by ne fuckin insicured fx fan
1,you are an idiot
1,well i was born and raised in africa and proud of it wth do you think africans are lesser than you or something take your ignorant ass somewhere else cuz i am not the one
1,and odumbo is an old lying inept loser communist ni er what s your point
1,try speaking in correct english as well what dummies are on here today
1,who the hell do you think you are saying anything sounds like you are the uneducated ignorant pieces of shit to me
1,answer yes no yes are you retarded meh nope
1,you do not wear your brain bucket you only hurt you and your family you become impaired you have the ability to hurt everyone
1,nice use of vulgarity attached to a teen you have real internet muscles nice racist screen name too if a male you fit the bill as a female nick name disgusting no way that you are a patriotic conservative
1,how was that not a strike you buffoon
1,shut up you dumbass bitch you are dirty brown water trash
1,well are not you phucking special it is easy to have all those things when your still living in your mother s basement loser
1,f uck off loser colon cowboy go back to your boyfriend s filthy dirty hair bacteria infested ass hole and hope that when you pull your c ock out it is not too brown or does someone else s s hit on your cock turn you on you and your type are sick disgusting perverts
1,and it is idiots like you wanting soviet bloc laws as long as they do not affect you your both retarded and you need to go back and read the bill of rights and the constitution again
1,clearly you are a fucktard not saying your right or wrong just saying who the fuck just randomly compares a rap group or any other mc on a post about a specific video and song about the dude s mama wtf does sh or any other mc or hammerdance have to do with this song
1,you are certainly what lenin called a useful idiot if you like islam so much go where it is practiced just the way you like it get to beat your wife and will kill your kids for whatever reason turns you on lie to anyone about anything just because it furthers the cause of islam and others around you actually believe your lies
1,it is not being a liberal that makes you like an idiot it is when you try to defend this pos potus that makes you look like an idiot
1,you are a loser
1,go away go away go away you dirty slut
1,how do you accidentally molest someone are you retarded or did it happen to you
1,quite sure your mama did too your dad should have went fishing the day he knocked up your mom cannot stand you and i do not even know you kids have died and all you have are these ridiculous comments go fix yourself a nice plate of neckbones and rice all i want is one little bone to get caught in that cesspool smelling throat of yours and kill you over you know what you probably banged a black chick and she told you that you did not measure up and laughed you right out of the bed is that your problem
1,you are a hater plian and simple
1,lol i diot we used your money lol what a waist of dna you are
1,eww i like bb but saying the rest of kpop is not real music just makes you sound dumb as fuck go back to your wonderfully lame articles and leave f x alone also thanks for increasing our views count muahahaha
1,that second year of fifth grad was a big fat waste of time you are one sad ignorant liberal troll
1,yerpathetic minutes ago in reply to design u lol you are an idiot but do not worry america allows you to be an idiot you canadians never answer this question why
1,oh i think i do let us put it this way it is not like watching united only muppets like yourself can see that is good football listen good on them for qualifying but the football is dross and a odd idiots posting here is not going to change that so think again about who the thickos are and add your name to the list
1,more grammatical errors vicky you are on a roll today you are so stupid
1,puberty ha just because you behaved like a man only when you were going through your puberty and been a gullible nancy your entire life doesnt mean everyone are like you pretty sure you got lady parts and vomit when you see blood or gore continue advertising your transexuality on world wide web i have already owned your ass
1,the muzzies do not like it when you fight back friggin cry babies go back to what ever hell hole you crawled out of you homicidal morons
1,im playing college ball what you sitting on worldstar frustrated with yo life lame im laugh fuck niggas like you everyday
1,the waste of time here is you and your comment
1,jonx you are crazy just plain crazy
1,you are a fool hispanics are hispanics are hispanic to the bone i hear rubio saying illegals good illegals good illegals good punish all anglo racists illegals good illegals good legals bad legals bad anglos bad anglos bad uncle fidel good uncle fidel good laraza good laraza good progs good progs good conservatives evil conservatives evil conservatives fools conservatives fools that his what i hear from your next prog idol that is going to break your heart
1,how do you know mother fucker stop assuming shit you don t know you don t know that man like you hypocrite son of a bitch
1,more grammatical errors vicky you are so stupid
1,go back to mediamatters troll you and your pond scum buddies are toast
1,and you are a terrorists pig
1,i am sorry that your gay affirming inner psych opath was disturbed mentally by my use of transgender but a punk that is a male hiding behind a female screen name has a myriad of issues like your contributing zero to the conservative cause ass does too if you keep stalking bitch i will show you who is your daddy
1,tamrabam you are a moron i assume you vote labour were you there no so shut your gob maggie had the balls to kick them out in no uncertain terms non of our current leaders would do that now
1,none of your posts have any value whatsoever
1,the key words being keep thinking something you have a hard time doing redneck racist retard
1,oh cj cj cj you fat ugly bitch its just so funny how much you need us you need us to tell you that your husband would rather fuck a barbed wire covered glory hole than touch your year old moldy vagina you need us to tell you about the health problems your poor children are going to suffer thanks to your fast food and brownie diet poor tweenie is going to be teased in school for being tubby you need us to tell you how stupid you are to go off of a fucking car thermometer to determine the outside temperature and then compare it to a fucking tropical climate state like florida how the hell do you function in life oh wait you dont you sit your fat worthless ass at a computer all day ranting about gay marriage i hate to break it to you but i guarantee your darling son sam is going to grow up to be the butt pirate you so hate what are you going to do then throw a bible at his head it wont knock the gay out of him even worse little sara is going to grow up to be a liberal gasp oh nos so your tweenie is going to be a fatty sammy a gay and sara a tree hugging hippie looks like your christian mothering sucks and you should try another route might i suggest getting the fuck off the computer and going to spend time with them
1,so lets pamper the child so the child never does better you are an idiot
1,it is been years and you birther idiots have yet to find one piece if evidence to support your claims so who is the stupid one you are gullible and ignorant if you believe our president was born in kenya
1,dickhead will just copy and use it do not bother we know rooster is all mouth and no balls
1,cheap pathetic references to nazi germany you dont know how good you have in this country a hole
1,i pull nothing from you hanni but keep parroting me in lieu of thinking for yourself it will at least make you sound a little smarter than you really are
1,you suck you probably do not have any friends your family probably abandoned you in disgrace go crawl back under a rock and do this world a favor and stop existing you think you are cool because you think you understand the situation and call this man a coward and pathetic well congratufuckinglations you just showed the world what a doouchebag you are i do not know if its because you are emo or you think trolling will earn you respect but i do not give a damn go dig a hole bury yourself in it and stay there if you do not have anything good to say you better expect nothing back
1,your point is as valid as the hole in your head that you obviously gave to yourself before making such an idiotic statement and bringing politics into it could your trolling be more obvious
1,fuck this gane this fucking fake
1,wow we got us a real literate einstien here do not we dush bag and such grammar maybe you should have stayed in school past the nd grade retard what happened momma spend all her welfare chk on booze and crack
1,greatness how do his balls feel in your mouth
1,he a hole i am a leaf fan and i know they are crap you did not read what i said today you hate them tomorrow you love them what are you years old with the go take a crap does your mom know you are on the computer and not in pre school getting beat up a hole does not sound so good does it
1,this post is so shallow and pathetic kudos to people who are growing old with out trying to defy the laws of nature and half of your posts are merely bad pictures you are trying to write off as not growing old well must be a slow news day because this is truly an all time low
1,a crazy muthafucka named gusto i fucked ya wife cuz the bitch is a big ho i fucked ya sister i fucked ya cat i woulda fucked ya mom but the bitch is too fat that shit was way funnier than it had any right to be
1,fuck off nigger you are not american you pos faggot
1,your an idiot
1,your an idiot
1,how do we know terry krepel is your real name if you are not a gutless coward you will provide an address and phone number now we are paying attention don t be a gutless coward and p ssy
1,idiot nayar you are mother fucker you are saying attack on shri harmandir sahib was a right action this shows you negative thinking about sikh community all siks are agree with building memorial thats why any sikh organisation does not oppose you have no concern with issues of punjab the wording you used in this article is very rude and this shows your hate about sikh community you are barking dog we do not care you
1,you are either very ignorant or terrible at sarcasm
1,chris please stop commenting because you are obviously still trying to catch your breath from your sucking off cook this has made you more retarded than usual
1,lol man your gonna call him a loser and to get a life when you are on here sticking your nose in their business your a douche bag who probably has never even seen a vagina go get laid and see that there is more to life than being a dick like you obviously are
1,hah your e only fpff and you tell me what to do i am waay older than you who you calling a bitch and a fug you douche bag bitch i wanna punch your eyeball out and kill ya fuckya
1,oh yeah like you would have stopped your car and assisted you are a lying idiot
1,you are probably a phuuking dyke aint ya beotch
1,you are a liar i was on that night dealing with two of you trolls an hour before anyone showed up this is not a physical fight here on this screen you moron in order for what you say to be the truth i would have to sit back and say nothing while others fight for me and if that were so you would never have been reading me for some time it s one thing for you to be a liar but quite something else for you to be a stupid liar
1,steve go brush your teeth with a revolver you dumb bastard
1,that has to be the stupidest comment i have ever seen
1,we have more where he came from do not rest we are watching your fat azz
1,let me rephrase in other words you are an insane pussy
1,with a screen name like yours you need to s t f u
1,if you lose your life because of stupidity good riddance
1,straight men will fuck anything
1,the filipinos have learned to realise that it is better to be associated with america than any other superpowers oh really check your history idiot i would rather we pick our own selves up so we would not be a joke to the planet such as this guy and what is your basis for this delusion an american fuck you in the ass
1,your mom must be a real low life trashy hook er
1,so now we know what you are by your own identification fool will you kindly moveon org and stop cluttering up the place and so we intelligent posters can post
1,maybe you should read that first sentence you wrote again slowly you are bending over to far to make an illogical point we are starting to see your ignorance
1,fuck you you fucking dork
1,poor deluded psychopaths news flash marriage is unnatural it is a construct of beings that have stepped out of nature for the most part construction vehicles technology all unnatural if you think about it now if you are talking about the pairing off into couples by animals in nature sure they do that but it has never been about property rights for them like it used to be for humans and there are same sex couples in nature as well since it is about making life easier in groups than it is by yourself so by that fact and the logic that goes with it gay marriage is as natural as hetero marriage you fuckers never have a reasonable leg to stand on it is always your invisible sky fairy and some bullshit some cave dweller spewed years ago step into the age of enlightenment you might like it
1,chavez is a total joke at the plate an automatic out he is only decent as a late inning defensive replacement you would know that if you were not so f cking stupid we have pearce betemit flaherty and andino once brob comes back to take over in the outfield until reimold and markakis get back none of them will make anyone s all star team but they all look like babe ruth at the plate compared to chavez grow a brain for chrissakes your ignorance is appalling
1,that nigga joe as shit fuckk out of here u dirty ass young bull
1,what a selfish slutbag that fucking fat ass chubby cheeked bitch probably got mad because her precious baby boy was hungry how dare he eat food not only do children require food to grow and become helathy adults but this bitch probably fed them hoho s and twinkies i can just hear her now get off my food you little shit that s my motherfucking twinkie momma s got the munchies then whack with a fucking hammer what a cunt
1,you are a complete fool slowly read what you have just written it makes no sense
1,id kill you if you were here not because im a gangsta but because i hate you f ck you
1,f v k you too
1,i talk about you all the time for instance denial is a warm yellow river running down your leg did you forget you have to pee sitting down again for the retards in the audience i am implying that hanniturd is a woman yes hanniturd the retard in the audience is you
1,thankyou eps your an idiot ricdose
1,tom you are an idiot on you suffer from whitmenitis aka you find it easier to blame others for your mediocre life achievements truth of the matter is you simply do not have much to offer
1,go back to your crapping unperfection home
1,and you are a weak bully
1,spelling mistakes like i said ignorant asshole so go put your butt plug in and shut your mouth hahaha estkill i see your getting roasted on here already i see your bios a lil homo from detroit whose moms a whore haha i wonder whose got the bigger mouth
1,that may be but you are asad little pathetic white man man eww times worse you child molesting mass murdering welfare bum you must be deported
1,what a fool you are we all know that you think of nothing more than being gay
1,why do not you take your pathetic intimidation attempt and shove it up your troll
1,not a slave tho you idiot internet racists
1,ill fuck you like an ape gay boy
1,with every one of your comments that i read i realize more and more just how batshit crazy you are
1,lil b drops mad shitty music because he wants you to sort thru it and find the good shit lil b has some amazing songs everything else he drops is just to piss of lil sensitive pussies like you
1,pussy bitch take my fuking house off of your picture i know it looks better than that nasty black ass you had up there but still
1,mia perkins is a knucklehead
1,look here cunt i hope you get raped by the devil i hope you get cancer and experience the most absurdly horrible pain a human being can feel i hope rick james slaps you right in the fuckdamn mouth then after all of that i will walk right up to you and shoot in the fucking throat
1,you must be one of the dumb ones here let me explain it to you when you have an inflated catheter inside you pulling it out will cause permanent injury there is nothing for this man to get over he s been damaged and needs to be made whole again pay the man and you you need to go out to your local dollar store and buy yourself a new brain the one you have currently does not seem to be working
1,holy sh yt you are one du mb ph uck
1,lets start back up with the libturdz and teaa tard name calling
1,you are a lying son of a bitch let us see you post some facts supporting your assertion
1,your absolutely right there is no way of explaining it to a moron like you go back to smokiung your crack ss hole
1,hey right wing moron you kidding me you are the cutest little gop whine baby on this forum
