label_bullying,text_message
0,yeah I got 2 backups for all that. I just hate when that happen. I been strugglin for a week now...handle that tho
0,I hate using my BB  but love my iPhone. Haven't tried the new BB. My BB is provided by my corp. I don't get to pick which model
0,wow lol sounds like a lot of piss then hehehe
0,not a damn thang..the typical rap beef. one person worrying about what the next is doing and the other respondin etc etc
0,well damn!! where have you been when i have needed you 'Mother Time'
0,watching without a trace too...hate when i miss the 1st 5 minutes when the person disappears!!!!!
0,which they do most of the time:-P I don't hate them either I wanted to be one once..but I figured out I couldn't live w/ myself
0,haha fuck i wish i was there :(
0,paranoid is wack as fuck...the best song on 808s is DEFINITELY Bad News
0,in London  I hate thee :( ENJOY YOURSELVES!!! &lt;33333
0,lollipop lolipop...oh loli loli loli....duh duh dum dum dum *Pop* Damn  im so bad at cheeeering people up &lt;3
0,You pretty sure Angel's ass is fake too huh? I hated that 'I wont answer cuz conroversy is good' shit. That means FAKE.
0,I hear that. I hate charging.
0,That sucks. My furnace started making funny noises the other day and I almost had a panic attack. I don't deal with cold well :)
0,"DAMN STRAIGHT
9na :)"
0,I hate your job too.
0,LOL! I'm not proud of my inability to deal with the cold :( I hate the treadmill too  but not as much as the cold...
0,I hate upping more than downing lol @seanzageek Its pretty awesome  AMD hasn't met release dates let alone beaten them in ages :)
0,Awesome :) I hate updating the BIOS LOL
0,Looks like a good competitor :) Wouldn't touch it personally  hate Symbian and Nokia Software :) My N95 is a bitch lol
0,ok that sucks. Someone needs to remind them about progressive enhancment....
0,Omg that sucks  but it's SO funny
0,lol  i know what you mean. But i kinda am a nerd so yeah  but still
0,I hate that bands have wardrobes.
0,that sucks dude  sorry for your loss
0,okay cool.  I can help you guys this weekend.  Those routers are a bitch to get working some times.
0,i hate when shows take holiday breaks. its killer to my free time.
0,I'm such a pizza freak... Mmm.
0,Oh honey  just hold in your mind the rankest thing a guy has ever done to piss you off  and you'll have bitchy in no time.
0,...okay. Maybe ONE more thing to look at on the interwebs. Damn you.
0,Damn! now I remember that people used to call you Benyl! forgot that little detail  you see
0,pretty much all bus drivers are fat... Besides Flavio.
0,http://twitpic.com/sbrn - we hate you phil. doesnt TV want you yet?
0,Thanks  Yeah shes fine they have her sedated..we hate hospitals so she was being a bit rude. So they knocked he out!
0,hate friendfeed...especially since Scoble endorses it :)
0,damn. oh well. i'll have to go find someone who's trained or something...wait  my WIFE is getting trained. now THAT's an idea!
0,You're going too? Fun.  @JesusNeedsNewPR I hate job hunting
0,damn . . . now I really  REALLY want breakfast food!
0,ughhh that sucks!!!!   How'd you get back from Sterling?
0,I hate it. Horrible stuff.
0,That sucks. Poor baby Andy. Hope he gets better.
0,OMG again eating :P yaar u eat alot but u don't look so fat what is the sceen behind this :S
0,wx in ny sucks! haha lots of snowww and blowing wind!
0,LULZ is gay!
0,Fuck yeah! :P Where've you been ...?
0,I HATE when that happens!
0,What I HATE are white collars on colored shirts.
0,that sucks. Where are you trying to watch it?
0,lol I hate you. And by hate  I mean love  but I still hate you XD
0,my time sucks... having a difficult time MANAGING w/o the structure of college classes but I really want to work w/ you on it
0,Ha! If I were your neighbor  you'd be tweeting about that bitch next door with the loud music. Admit it.
0,Stumped on that one...hate to admit it!
0,Well  well  well...damn that sounds fantastic LOL I'm sorry  what exactly was it that you wanted?
0,ugh that sucks babe
0,damn straight! Happy birthday Maddie!!! Xoxoxo.
0,that is great. I would hate for you to have that big truck come by during the holidays.
0,"I've never found a way so I ""star"" those. I love GMail when I don't hate it."
0,Hate what ?
0,"OMG I LOVE THAT SONG XD

ITS FUCKING HILARIOUS"
0,I hate auntie flow too.  I should be starting soon. :(  I gained weight this week from pms (eating a lot)!
0,How do you do that? I HATE my Blackjack so much I have almost resorted to violence?
0,if the opportunity arises  aye aye. God  I hate kids.
0,yeah hes fucking serious
0,"Being on fire is ""safe""? I'd hate to see what you consider peril!"
0,Sure  name your price. Oh fuck  sorry I'm not THAT pissed
0,fuck...I forgot
0,i hate myspaces people you should know
0,ah damn!
0,the beef stew from that latin place? I fucking loved their coffee i wanna eat there again.
0,AHHHH. Brandy!!!! I LOVE 'HUMAN' like a fat kid loves cake! Thank you for making this album. AHHHHH I love you girl!! OMG!!!!!!
0,Dude. That. Sucks. :(
0,haha thats sucks.. if that happened to me  idk what i would have done.
0,oooo she's gonna go kick your ass now XD
0,I HATE tht
0,whale wars?? sounds epic.
0,can't you wind the flash levels down? I hate flash  I'd rip the things off if I could...
0,LOL!!  It's ok to admit that you got fat  or phat :-P. Hahahahaha jk :-D.
0,"drm sucks.
-a"
0,drm sucks.
0,don't forget ppl sitting around working in a tshirt/boxers lol. J/K  my wife is a neat freak & believe it or not I kind of am too
0,Crying. Literally. You win. I'm destroyed  laughing and crying and I hate and love you all at once.
0,All computers hate you back! Haha...good luck.
0,Big Fat Quiz of The Year 2008 is on C4+1.
0,damn it!
0,Thing I hate the most = Alternate side of the street parking rules.
0,Awww bless  darling  you know you can *always* wear a wig and stilettos. In other news: National Treasure sucks.
0,Weird. I gotta say  I love my pig.
0,There was a SVT tweet-up last night  damn I was down at BJ's in Cupertino till 7ish
0,i hate it when people buy stuff between thanksgiving and christmas!! Cuz then you don't know what to get them!!
0,Oh  heck! I was all ready to pull a Dan Rather and pronounce Dick Cheney dead.
0,In case it's not obvious  the rabbit  glasses and ass are not phone-cam pix.
0,Hate them.  If I'm not pulled in by their previous tweet content I might even unfollow.  Basically still selling to a stranger.
0,Actually I have some problems with the British pronunciation... And yes  my Internet service sucks..
0,those will sell like hot cocks....cakes...hot cakes...damn it!
0,it's the power of having ass loads of money....some people could release an album of static and it'd still go platinum
0,damn  sorry to hear it
0,see previous. Damn twitter.
0,"He's got NO right  but that makes no diff to him. He's just still mad he went from ""cotdamn!!"" to ""oh.....damn."""
0,if u hate shapes  how can you pull shapes?
0,OMG. GREAT list! I can add to TMI Freak. Folo one who shares stories about sex toys. No joke.
0,I hate it so much! :)
0,Would you mind if I blogged about it to? Hate doing that without asking first! #cleanup09
0,IT'S SO FUCKING CUTE
0,i hate it when that happens :)
0,so he isnt gay anymore?
0,are you still at school?! Ha!! Sucks to be you!! I finished two and a half weeks ago.
0,and THAT is why I hate that movie/musical. Despite the awesome music  there's no redemption  and I love redemption.
0,oh and go blue whale watching. forgot to say.
0,I got a gigantic  bad ass pizza cutter.  It's not just for pizza anymore.
0,Me will be snoring in about 10... tired. I woke up at 5  damn it all
0,I work in McCormick Place & hate the commute to nwi. You probably wouldn't even need to rehearse with the repetitive repertoire.
0,I swear I had to really force myself today. hate days like that!
0,It really sucks  most come on due to too much stress. I cannot control them. It has ruined a lot in my life  but keep pushing on!
0,I hate Heidi and Spencer!!!!!!! I want them off the show!!!!!! YUCK!
0,Damn it all... I hate being trendy! LOL!
0,thanks. it's part 2 we got stuck on. The rolling didn't seem to work. I'm a loser :)
0,yeah gymboy  time for you to fuck those weights and do some plyometrics
0,damn that's quite a long code...but  one thing I can tell right now is that STDOUT and tty output streams need not be same
0,u take CNN's word over mine? damn it. already told u that. ;)
0,word? oh damn! didn't expect that response
0,ah damn Sosa not the Bumsquad fam.......Hopefully you didn't drop $600
0,I thought 7lbs represented the weight of the burdeon on his shoulders. By the way the movie was pretty damn good wasn't it?
0,You have waaaaaaaaaaay too much free time! ...but that's damn cool!
0,damn shame right? Specially since there's so much uncut dope out there!
0,hey- finally managed to book the damn tickets online- took me over an hour!!! PVR sucks.
0,damn them! I'll link to another
0,oh DAMN.  I should be SO much more sophisticated  but that IS a cool #song.  OK  except that last bit.  eep.  a little too #MS
0,the new MacBook Pro?I am getting used to the tapping. I hate the way new track pad clicks. Too loud. Too hard to press.
0,if Santa's magic dies  he just becomes a regular old fat guy in a funny looking suit taking a 747 back to the North Pole
0,damn!
0,aww damn!  I think we need to kick him out the league!  LOL
0,also need to know if it is needle free as belenophobic husband would freak.
0,BOTH ARGHH!!!! I'm gonna nap cuz I'm emo right now.
0, Damn him!!  Oh well...worth a try.
0,My friend is gay so it was kinda perfect - he said I could shop all day and then we'd go out. And no putting out! ;)
0,I have family flying in soon. Also I don't fly O'Hare in winter. My new rule. HATE. He's at a nice hotel though. :/
0,"I'm not sick  unless by sick you mean bad ass. In which case I am totally sick. Sick with a ""ph"" yo!"
0,I hate when that happens!
0,I knew it wouldn't freak u out when ur time came!  Capture it if u can.
0,dammit I need to get an iphone. no  damn verizon...
0,no kiddin! I hate wedding planning mania.  probably the reason i got married by a justice of the peace with two witnesses.
0,you're damn right I did
0,I never thought of it that way - but damn - that IS a good name..
0,He was a poodle of some kind. Toy maybe? I remember his name was Jack. So damn cute I wanted to just pick him up and squeeze him!!
0,dude  you must earn  or have a lot of dough to shell out 50usd a day! Damn  that's serious!
0,it's pretty bad ass YO!! and the guys that run it kick ass too
0,"lol...I might...sun isn't up yet.  Busy  multiple projects and people ready to kick ass or ""die tryin"" :)) wErd"
0,niCE that totally kicks ass!!
0,damn skippy trippy :)
0, man! I have an idea that you will LOVE & HATE!!
0,is there a good intro to cucumber+rspec? the wiki sucks.
0, when i was young  i used to hate terry preichet!because i compared him to tolkien... pretty dumb in hindsight!
0,I hate how the corporate world wants americans to shave everyday.
0,It's just so damn cute. even the ghosties that KILL YOU OVER AND OVER AND OVER AND OVER.... *ahem* are cute.
0,Damn  Thats out of reach for me now. Thanks anyway. Ever tried this ? http://camstudio.org
0,Thats cause they are School Girls! GAY!
0,and also jus my lappy is gone so m usin last fm...othrwise who gives a damn...once its bak i'll hav all the songs so bbye last.fm
0,ugh that sucks. Its good she cares but still I'm sure you'd be ok.
0,"Kelidawn me too! I hate putting it away just s much. But i do luv the way it smells when it comes out the dryer!
Ashley"
0,damn you! was there grape? please tell me you've tried grape. its the best!
0,damn I wanna go Ms Baker  too!
0,damn I wanna go see Ms Baker  too!
0,You should had me do that cleaning. Damn.
0,yeah  but are they stealing them from those damned stores that hold the poor things hostage in windows? i hate those stores
0,Damn him!  I had my milk all ready for some dunkin'
0,that sucks.
0,I hate to say it  but  I'm day 14 :( That is the only item both my kids have in common on there Christmas list this year!
0,it's cuz twinkle sucks :)
0,have a safe trip  planes freak me out :(
0,Will Tweetie ever startup/refresh with the last read tweet like Twitterific? I hate scrolling wayyyy down to see tweets i missed
0,Ahh! Damn! Thank you! Is there any way to show them?
0,oooh no be well that sucks - i know :-)
0,to bad i am the god damn WINNAR!
0,ur telling me! Especially out on the back roads in east bum fuck!
0,you are gorgeous as fuck.
0,ouch that sucks.
0,Yeah  do you believe our kids hate steak?  When we have steak  they eat lips and you know whats. LOL
0,Damn girl  these are CUTE! http://tinyurl.com/8d8v8c
0,I think I have the same nasty chest cough. It sucks.
0,know you have the Yahoo T&C story too... damn what are they chasing the few customers they have away now?
0,- thanks for following Austin Girl's @fatbastardrules. Fat Bastard  loves pink stilettos & pink iPhones. Not afraid to  ...
0,- Austin Girl & Fat Bastard are giggling with anticipation over Kitty Kat's Halloween pics!
0,- Austin Girl's Fat Bastard (Beagle) fibs on reading diet & exercise books  really reading 'Guide to the Best Chow in Town.'
0,#NAME?
0,I WANT TO...but i will be in vegas....FUCK lol...i wanna go see the wrestler...its in SB i assume? gimme the details
0,Lucky u! Its summer here in Aus..bloody hate it when it gets over 35c...wanna swap? Ill make a snow man in thy honour! lol
0,well I try my best. SOCIAL media..keep it social damn it!! peace love and happiness leslea =)
0,do you mind that? i hate that term.
0,thanks sweety. Loki just rubbed me in with Ben Gay before he passed out for the night. too.
0,I'm surprised you hate this movie so much - um  what exactly is a good movie for you?
0,"oh man that was a funny tweet. I'm in tears over here. Hahaha. I hate mac ""genuises"" soooo much."
0,smart ass - here http://thetyser.com/
0,oooommmmmmmmg im watching biggest loser and i dont know who to vote for who are u going to do
0,hey hey Biggest loser couples starts on tuesday
0,that's the spirit! kick ass!
0,no. no. no toasted ass. kaya toast please! :D
0,he was yelling at me that golden axe sucks  I have to play castle crashers. Which is the same game but newer.
0,right now I hate you and wanna be you at the same time... Such a weird feeling. Btw  Dirty Sexy Money rocks ;-)
0, how is your blog? Your blog makes me hungry. I hate cooking  but like eating :)
0,"btw -  quick disclaimer  in general I hate 90% of the ""believers"" I have met.. especially christards."
0,today its warm though  crazy ass Cali weather
0,I hate it when that happens. I've been yelled at by many bus drivers in the past.
0,"on todays burn the fat blog. Did I strike a nerve? http://tinyurl.com/69xzth "" A-Bud: I thought it was dead on."
0,CAAAAARRRRBBBS & FAT - yum  thanks for sharing ;)
0,i hate it when that happens :(
0,that was when wrestling was bad ass. Raw is war  against wcw
0,Damn!! Thats cold! The reason I'm always there for my kids!
0,I prefer no doz pills washed down with coffee to get my ass movin.....
0,who ruined your day im looking for an ass to kick 2day
0,something about piss should do. or zebras.
0,oh blah. I noticed the used look  that's easy to do but damn... green?? ARG.
0,:  that sucks!  well  maybe not...  maybe i can get some things done before you start buggin' me. ;)
0,good point cause I need someone to take care of that damn pony
0,I've had a few 'fat' comments.  yeah  cause I claim to be thin!!
0,damn  man. those look like some good eats.
0,if we can get a big enough turnout. i can line up some sponsors for a kick ass reception. we've got till then to grow the #tpt
0,lol....hate when movies get the poker wrong.
0,Damn! Wish I was there!
0,I have no doubt that there is a problem there  it's just not the only problem.  I hate mutilple variables in a problem!
0,Damn  they had frontiers there! next time. have you seen The ordeal?
0,Andrew was being boring before so i stopped watching. Damn  he has been on forever  haha.
0,i hate you for making me google that.
0,Alyssa Milano is off tha market!!!! DAMN!!!! LOL
0,notice they waited for me to leave before they kicked gordons ass. ps 90min wait at border.
0,BET sucks  except The Wire reruns
0,cool. what kind/speed is it? my 500 has about 60 gigs left and i hate deleting things
0,No  you  I hate you (because of PES :p)
0,damn! Next time It will be correct  I promise ;)
0,Make it again.  I'll post on it.  I have lots of micro-hate.
0,Safest not to get on the airplane at all  IMO.Hate to fly  though going to grit my teeth & do it again in Feb after 8 yrs. :-(
0,damn I missing the leak! At a bar enjoying this ice storm.....an iphone work perfectly
0,damn it  i miss having pets now!
0,damn it  i'll trade you!
0,ya  so am i and i stay fat. Evil! You're so lucky. Its unfair!
0,oh.. Hmph  that sucks. My niece just tried to open one of my christmas presents.
0,LOL ... no ... a very large dark sausage-like-thing made with pig's blood and spices. Surprisingly tasty despite that :)
0,fuck looking cute  i'm strictly Timb boots & army certified suits
0,not to piss u off  but I got a cut yesterday.
0,I'm not getting the firewood...its saturday  damn it!
0,got damn  this dudes flow is boooooring. *sleeps*
0,got damn man. that's nice!!
0,Penn (shitbird) & Teller (I hate them. A lot) vs (the irrisistably awesome) Jamie & Adam? Sorry  is there even a question in there?
0,...they're fucking jeans.
0,Must Hate Hitler.
0,Wouldn't know Greys if it bit me on the ass. I think she's been a supporting player in some ish I saw already. Total b-list.
0,alybrooke i can! I hate shopping!
0,FUCK YES!
0,Fucking useless ... Sling the Disability Discrimination Act at em !!!bloody terrible !!
0,hahah! OMG  that was the creepiest clip of crazy I've ever seen in my life and I hate that part of the trailer! AHHHH!
0,oh I hate auto DMs like that!
0,that sucks.  I heard about their closing a few months ago.  They were a great group of people.
0,that sucks  how many dogs? ...2?
0,Heh! Parcells is a bad-ass who knows how to help you to find your inner bad-ass. Hey  that sounds like a book.
0,Thanks for the DM...I hate them 2 but another player over 100 million...that makes 5...Deep Pockets???
0,I'm fairly certain you'll be seeing more of Kevin on Best Damn in the coming months.  At least more rants  if nothing else.  :)
0,Damn  I'm working @ home this aft or I'd drop by (my office is right near there). Don't suppose you'll be there again tomorrow?
0,absolutely nothing  being the point :P and i have gay exams tomorow  i really should use this time to revise....but arts more fun
0,dont hate hun.
0,@inworship let's not start with the gay stuff  I just watched Chuck & Larry!
0,I meant a smiley face - darn fat fingers. I love your goal.
0,Srsly  me too.  He is such a fucking dreamboat.  I still spazz out when he sings EODM in Watching the Detectives.
0,damn  now I have to go for a run ...
0,damn! nice to hear someone playing Q3A! missing it. Try a game against Xaero and let me know :P - Grunt laugh-&gt; grr..Ha-ha!
0,http://tinyurl.com/6d4a86 so fucking CUTE!!!
0,http://i120.photobucket.com/albums/o163/kelcee247/0000diesal.jpg oh craig! damn him & his sexy hips lmao
0,Damn  I only got 1. I'm gonna get a complex now.
0,dude I'm still pissed about that damn movie
0,oh yeah we'd be soft  fat and happy LOL!
0,hahahaha damn right!
0,awww man e'rbody coolin' my wild ass brother was buggin earlier  so i went a drunk a 5th to the head wit my cuz bout noon but
0,Hell yeah I cried... a world without buffy is a world without hope... Sarah michelle gellar too damn beautiful to die hee hee
0,damn! Should have dome that
0,You have serious iPhone keyboard accuracy issues  krk! or really fat fingers.
0,Tough time of year to keep the weight off. Without my bicycle commuting  I'd be hosed. Road bike has some dust on it. Damn...
0,I have that dream.  I have the gay husband already  but apparently he's missing a gene.
0,I nominate @BadEvan in #personal because he's local  cute  gay  and an interesting Twitter user.
0,It's good to know that even people within Marvel hate Gambit.  It gives me hope.
0,lol I know. I'm not a damn fool.
0,damn.. Intense.
0,haha don't hate on my mad skills.
0,not a fucking problem for me :)
0,me board and not feeln good  From to much parting I hate Being alone times like this. I like boys ;-)
0,who u tellin i hate doing them im doing them now i was suppose to be orff an hour ago.....
0,That sucks. I am sorry  want me to vagina punch her for you  since I am sure you hurt too bad to do it yourself???
0, DAMN mood swings..
0,true that. with more fat.
0,sorry about that. I understand  it's my epic failure in my  parents eyes. I will be forever fat to them :( don't listen to them!
0,ah traffic sucks!!
0,Ha LOL. Don't worry. Josh and I don't exist on the winner or loser side. And the Pix.ly logo is on the loser side though.
0,is any of them super bad ass?
0,le gasp! I'm so jealous  I fucking love NY!
0,Dang Id hate to see whats in Twinkies!
0,to expect a 20+ mpg auto that does not look like a God damn Easter egg or roller skate  that is unreasonable. ;)
0,take yo ass to bed....lol!
0,I HATE ART COMPLETELY! Did you have to do design and expressive and all that shite? I hate it!
0,sucks that the rule is when u sell property back u lose a bit
0,Thanks for your kind words about Sincerity Sucks. That's always been one of my favorites.
0,Damn. Wizards beat sultans every time. I'll have to try harder. ;)
0,Oh no! That sucks!
0,"Wrestling with this 2. Yeah I'm different. This wk I decided  ""Fuck all that."" With some  I'll work hard to explain. Otherwise.."
0,is nibbling my ass while i sleep. i'm into it.
0,just so you no  my ass hurts more now. right where the leg meets the butt.. the cup-able part.
0,i haven't been fed cock since saturday morning!
0,or pussy.
0,"The ""That's 'Smart Bitch' To You"" one."
0,Long day?  I hate meetings.  I HATE them.
0,That's pretty cool.  My first exposure to the concept was gaming in middle school.  I was (am) such a nerd.
0,"you just love Plies ""fruit snack eating ass"""
0,they waiting for an Xbox or something? damn lol
0,Damn we keep missing each other!
0,Watch me fuck up typing on my iPhone... Hahaha
0,LOL  no  I'm in Utah. If you tell me she has anothe son named Aeddon  I'm going to totally freak out though!!!
0, @ BrettLegree is a genius  really. If he says it sucks  it sucks. I work for myself and still have to use it. :(
0,im glad u agree. i was starting to wonder if i was being an ass about that one
0,I love that one  hand it over  or we'll kick your ass  Santa!
0,Damn you for stealing the heat.
0,I'm scared! Pig in a suit? Were they all out of blankets?
0,that is  of course  if our god damn modem stays synced...
0,Tea sucks. Recommends 3 cups/night. Right.
0,Damn  it will probably take longer than that. I'll check when I'm at the post office.
0,what club u @? Damn  I fell alseep!
0,"they do but with pain and limitation... It sucks
Thank God for bootcamp"
0,You are so right. I hate commercials. I mute them whenever we watch TV.
0,do you play? I have kind of a love-hate relationship with that stupid game.
0,I fucking love Mr Egg! It's saved my life after many a messy night out
0,I know! Damn it! My apologies  I was flattened by the lurgy til New Year. Up and down to London a lot now so gin WILL occur
0,wait  wait  i know: to drive you insane. have i mentioned that i hate spammers  especially@hkdimon  ones who slip through akismet.
0,is that what's happening? we are freezing here in socal office too. i applaud the plan  but hate the execution.
0,i concur cold sucks  but it rains too much in the tropics  there's no real win-win
0,well that sucks. lol discriminating against WoW players...though i can see the logic
0,My friend has wii fit and it's pretty damn cool. Technology amazes me.
0,hey I was wondering that too. Kept getting 'no service'  was pretty gay. I used the pennytel app instead  optus's loss ;)
0,I disagree.  You're only a poser if you flaunt it and/or have your nose stuck up in the air.
0,...it is pretty damn funny to think that Bush drives people crazy to the point that they resort to throwing shoes.
0,Damn Good Gift
0,Smh I thought Soulja Boy Would Do some Good Numbers....This is When Parents Buy The Most Stuff For There Kids.....Damn Bad Times...
0,Damn...Just been Bad Luck For you lately My Boy hope things turn around for you.....
0,Yea that Simply Orange is That Deal..I be Drinkin That 2..Man I Hate Water its so nasty i never drink it lol...Juice Or Pop Forme
0,I hate it when I get sentences stuck in my head! It's so annoying!
0,gluten and dairy free mix from @traderjoes . Damn good! i highly recommend.  Silk soy egg nog's not so bad either :D
0,you should come make that for me! I haven't had lunch today. I feel kinda sick again. That sucks.
0,I figured so  but I went with the obscure Peter Sellers nod. Me = nerd.
0,Damn  last tweet was for you :P
0,ok  I like this one...damn I wish we could these here in Oz...ROCKMOUNT FLEUR DE LIS SHIRTS FOR MEN...get the black/silver one
0,#NAME?
0,- sucks for you man. @JennJaye took weeks to get over her latest illness.
0,- I agree. No More SteveNotes. Damn!
0,ah damn...my linksys is v.5  won't work with Tomato.
0,fuck yeah!
0,damn I should check twitter in the morning I guess  I would have known how bad out it was thanks to you! Yet I fell on myass
0,damn I was also going to say that the girls might be shopping at linens n things
0,"How are you ""fat"" if you have a fairly chiseled face in your pic?"
